{
  "schemaVersion": 1,
  "jobId": "contract-job-1",
  "traceId": "edge-contract-1",
  "url": "https://media.example.test/movie/master.m3u8",
  "finalUrl": "https://media.example.test/movie/index.m3u8",
  "provider": "contract",
  "movieSlug": "example-film",
  "episode": "1",
  "playable": true,
  "retryable": false,
  "playlistKind": "media",
  "durationSeconds": 120.5,
  "segmentCount": 12,
  "sampledSegments": 3,
  "brokenSegments": [],
  "variants": [],
  "adMarkers": [],
  "introMarkers": [],
  "discontinuities": 0,
  "manifestLatencyMs": 42,
  "healthScore": 100,
  "analyzedAt": 1788067201,
  "errors": [],
  "encrypted": false
}
